,game,release_date,genre,platforms,developer,esrb_rating,ESRBs,metascore,userscore,critic_reviews,user_reviews,num_players,summary
175,Uncharted 4: A Thief's End,"May 10, 2016","General, Modern, Action Adventure, Linear",Dreamcast,Naughty Dog,T,,93,8.8,113,15923,Up to 10 Players,"Set 3 years after the events of Uncharted 3, Nathan Drake has apparently left the world of fortune hunting behind. However, it doesn’t take long for adventure to come calling when Drake’s brother, Sam, re-emerges asking for his help to save his own life and offering an adventure Drake cannot resist. On the hunt for Captain Henry Avery’s long-lost treasure, Sam and Drake embark on a journey to find Libertalia, the pirate utopia deep in the forests of Madagascar. Uncharted 4: A Thief’s End takes players around the globe, through jungle isles, urban cities and snow-capped peaks on the search for Avery’s fortune. [Naughty Dog]"
176,Super Smash Bros. Ultimate,"Dec  7, 2018","Action, Fighting, 2D",Dreamcast,"Nintendo, HAL Labs, Bandai Namco Games, Sora Ltd.",E10+,,93,8.6,99,3392,Up to 8 Players,"Inklings from the Splatoon series, as well as returning Smash characters like Mario and Link will be making appearances in this classic Nintendo franchise's Switch debut. Faster combat, new items, new attacks, new defensive options, and more will keep the battle raging whether you’re at home or on the go. "
177,Braid,"Nov 12, 2009","Action, Platformer, Platformer, 2D, 2D",Dreamcast,"Hothead Games, Number None Inc.",E10+,Language Mild Cartoon Violence,93,7.8,20,240,1 Player,"[Playstation Network]  Explore the human condition and manipulate time as our hero Tim leaps onto the PlayStation Network in the lush, painterly world of Braid, a puzzle-platformer that takes you from a house in the city on a journey through a series of worlds to solve puzzles and rescue the princess. In each world, you have a different power to affect the way time behaves, including the ability to rewind, create parallel realities and utilize time dilation to overcome the many obstacles in your path. There is no filler in this game; every puzzle shows you something new and interesting about the game world. [Hothead Games]"
178,Mass Effect 3,"Mar  5, 2012","Role-Playing, Action RPG, Action RPG",Dreamcast,BioWare,M,Blood Partial Nudity Sexual Content Strong Language Violence,93,5.8,30,1994,Up to 4 Players,"BioWare completes the Mass Effect Trilogy with Mass Effect 3. Earth is burning. Striking from beyond known space, a race of terrifying machines have begun their destruction of the human race. As Commander Shepard, an Alliance Marine, the only hope for saving mankind is to rally the civilizations of the galaxy and launch one final mission to take back the Earth. "
179,Paper Mario,"Feb  5, 2001","Role-Playing, Console-style RPG",Dreamcast,Intelligent Systems,E,Comic Mischief,93,9.0,15,464,1 Player,"Mario pals around in an all-new action adventure! Mario's back in his first adventure since Super Mario 64, and this time, Bowser's bent on preventing a storybook ending. When Princess Peach is kidnapped, Mario plots to rescue the seven Star Spirits and rid the Mushroom Kingdom of Koopa's cruel cohorts. As he travels from the tropical jungles of Lavalava Island to the frosty heights of Shiver Mountain, he'll meet up with seven all-new companions... and he'll need help from each one or there'll be no happily ever after."
180,Wipeout XL,"Sep 30, 1996","Driving, Racing, Futuristic",Dreamcast,Psygnosis,,Animated Violence,93,8.7,8,44,1-2 Players,"The original scorched the game world and became an instant classic. Fast-forward now to a brutal new generation of anti gravity racing. Loaded with faster, smoother graphics, more tracks, more crafts, and a range of nasty new weaponry. Wipeout XL will give you the rush of your life."
181,Grand Theft Auto: San Andreas,"Jun  7, 2005","Action Adventure, Modern",Dreamcast,Rockstar North,AO,Blood and Gore Intense Violence Nudity Strong Language Strong Sexual Content Use of Drugs,93,8.8,58,188,1-2 Players,"Five years ago Carl Johnson escaped from the pressures of life in Los Santos, San Andreas... a city tearing itself apart with gang trouble, drugs and corruption. Where filmstars and millionaires do their best to avoid the dealers and gangbangers. Now, it's the early 90s. Carl's got to go home. His mother has been murdered, his family has fallen apart and his childhood friends are all heading towards disaster. On his return to the neighborhood, a couple of corrupt cops frame him for homicide. CJ is forced on a journey that takes him across the entire state of San Andreas, to save his family and to take control of the streets. "
182,Resident Evil 2,"Jan 25, 2019","Action Adventure, Survival",Dreamcast,Capcom R&D Division 1,M,,93,8.7,27,1054,1 Player,"In Resident Evil 2, the classic action, tense exploration, and puzzle solving gameplay that defined the Resident Evil series returns. Players join rookie police officer Leon Kennedy and college student Claire Redfield, who are thrust together by a disastrous outbreak in Raccoon City that transformed its population into deadly zombies. Both Leon and Claire have their own separate playable campaigns, allowing players to see the story from both characters’ perspectives. The fate of these two fan favorite characters is in players hands as they work together to survive and get to the bottom of what is behind the terrifying attack on the city. Will they make it out alive?"
183,INSIDE,"Jun 29, 2016","Action, Platformer, 2D",Dreamcast,PLAYDEAD,M,,93,8.3,87,713,1 Player,"Hunted and alone, a boy finds himself drawn into the center of a dark project. The second game from Limbo developer Playdead."
184,World of Warcraft,"Nov 23, 2004","Role-Playing, Miscellaneous, Massively Multiplayer Online, Massively Multiplayer, Board / Card Game, Fantasy, Fantasy",Dreamcast,Blizzard Entertainment,T,Blood Suggestive Themes Use of Alcohol Violence,93,7.4,57,3286,Massively Multiplayer,"Four years have passed since the aftermath of Warcraft III: Reign of Chaos, and a great tension now smolders throughout the ravaged world of Azeroth. As the battle-worn races begin to rebuild their shattered kingdoms, new threats, both ancient and ominous, arise to plague the world once again. World of Warcraft is an online role-playing experience set in the award-winning Warcraft universe. Players assume the roles of Warcraft heroes as they explore, adventure, and quest across a vast world. Being ""Massively Multiplayer,"" World of Warcraft allows thousands of players to interact within the same world. Whether adventuring together or fighting against each other in epic battles, players will form friendships, forge alliances, and compete with enemies for power and glory. A dedicated live team will create a constant stream of new adventures to undertake, lands to explore, and monsters to vanquish. This content ensures that the game will never be the same from month to month, and will continue to offer new challenges and adventures for years to come. [Blizzard Entertainment]"
185,Grand Theft Auto: San Andreas,"Jun  7, 2005","Action Adventure, Modern, Modern, Open-World",Dreamcast,Rockstar North,M,Blood and Gore Intense Violence Nudity Strong Language Strong Sexual Content Use of Drugs,93,8.9,47,3807,1 Player,"Five years ago Carl Johnson escaped from the pressures of life in Los Santos, San Andreas... a city tearing itself apart with gang trouble, drugs and corruption. Where filmstars and millionaires do their best to avoid the dealers and gangbangers. Now, it's the early 90s. Carl's got to go home. His mother has been murdered, his family has fallen apart and his childhood friends are all heading towards disaster. On his return to the neighborhood, a couple of corrupt cops frame him for homicide. CJ is forced on a journey that takes him across the entire state of San Andreas, to save his family and to take control of the streets. [Rockstar]"
186,Flipnote Studio,"Aug 12, 2009","Miscellaneous, General, Application",Dreamcast,Nintendo,,,93,7.6,7,68,1 Player,"[DSiWare]  Let your inner artist loose with Flipnote Studio, an easy to use and surprisingly powerful animation application. Create Flipnotes by using the stylus to write letters and draw pictures, capture sounds using the microphone, and even insert photos captured with the Nintendo DSi Camera. Save a Flipnote with multiple pages that run successively and you've just made an animated Flipnote that works like a flip book! And if you feel like sharing your masterpiece, send it to your Flipnote friends or, if you are a registered Hatena.com user, release it via Flipnote Hatena, an online service run by Japanese Web-service provider Hatena. With such a large set of tools available, you’ll quickly find that there are many ways to enjoy Flipnote Studio. [Nintendo]"
187,World Soccer Winning Eleven 7 International,"Feb 17, 2004","Sports, Traditional, Soccer, Sim",Dreamcast,KCET,E,,93,8.4,28,59,1-8 Players,"Winning Eleven 7 International features 100 teams, 21 stadiums, new player models and key additions to the Master League. Winning Eleven 7 also utilizes a custom designed engine that allows for great flexibility and customization. Upon entering a match, players will find incredibly masterful gameplay, beautifully rendered stadiums and picture-perfect player models. While on the field, players will experience true-to-life gameplay, with carefully tuned A.I., realistic pace and balance. [Konami]"
188,NBA 2K2,"Oct 24, 2001","Sports, Traditional, Basketball, Sim",Dreamcast,Visual Concepts,E,,93,7.4,12,23,1 Player,"Exploit the defender with a lightning quick drop step move before you launch all out attack, finishing with an impressive dunk! With enhanced player performance such as this, the most renowned basketball game ever has been improved on all levels. Run the floor with new moves, exploit the new steal system then stand back in awe as you're put right behind the cameras in replay mode. With the addition of legendary urban playground courts, including the famous Mosswood Park, NBA2K2 is the true basketball experience."
189,SoulCalibur II,"Aug 27, 2003","Action, Fighting, 3D",Dreamcast,Namco,T,Suggestive Themes Violence,92,8.7,41,171,1-2 Players,"A new page in history has begun as the most highly-anticipated fighting game ever finally arrives! The greatest 3-D weapons-based fighter will provide non-stop action, excitement and surprises as you go one-on-one against your favorite challengers. 13 historic fighters plus all new combatants including Necrid, specially designed by Todd McFarlane Productions, Inc. Unique special guest fighters for each platform include Link (GameCube), Heihachi (PS2), and Todd McFarlane's Spawn (Xbox). 7 exciting modes of play including Arcade, Vs, Time Attack, Survival, Team Battle, Practice, and Weapon Master. Collect 200 different weapons in the all-new mission-complete Weapon Master mode. [Namco]"
190,The Elder Scrolls V: Skyrim,"Nov 11, 2011","Role-Playing, First-Person, First-Person, Western-Style",Dreamcast,Bethesda Game Studios,M,Blood and Gore Intense Violence Sexual Themes Use of Alcohol,92,6.7,16,2787,1 Player,"The next chapter in the Elder Scrolls saga arrives from the Bethesda Game Studios. Skyrim reimagines the open-world fantasy epic, bringing to life a complete virtual world open for you to explore any way you choose. Play any type of character you can imagine, and do whatever you want; the legendary freedom of choice, storytelling, and adventure of The Elder Scrolls is realized like never before. Skyrim's new game engine brings to life a complete virtual world with rolling clouds, rugged mountains, bustling cities, lush fields, and ancient dungeons. Choose from hundreds of weapons, spells, and abilities. The new character system allows you to play any way you want and define yourself through your actions. Battle ancient dragons like you've never seen. As Dragonborn, learn their secrets and harness their power for yourself."
191,Prince of Persia: The Sands of Time,"Nov 12, 2003","Action Adventure, Fantasy",Dreamcast,Ubisoft,T,Blood Suggestive Themes Violence,92,8.0,41,102,1 Player,"Embark on a journey of scorched sands and ancient legends.  A young prince, drawn to the dark powers of a magic dagger, unleashes a deadly evil upon a beautiful kingdom.  Guide the Prince on his quest to reverse the curse by using the Sands of Time, a power which allows you to erase the past, see into the future and slow down the present.  Perform gravity-defying acrobatics and swashbuckling attacks in a staggering array of landscapes and kingdoms.  Restore peace to the land and fulfill your destiny."
192,Call of Duty 4: Modern Warfare,"Nov  5, 2007","Action, Shooter, Shooter, First-Person, Modern, Modern, Arcade",Dreamcast,Infinity Ward,M,Blood and Gore Intense Violence Strong Language,92,8.5,40,3592,"1 Player, 16 Players Online Up to 18 Players","As Call of Duty 4: Modern Warfare's single player campaign unfolds, the player is introduced to new gameplay at every turn – one moment you are fast-roping from your Black Hawk helicopter after storming into the war zone with an armada of choppers, the next you are a sniper, under concealment, in a Ghillie suit miles behind enemy lines, the next you are engaging hostiles from an AC-130 gunship thousands of feet above the battlefield. Mixed with explosive action, Call of Duty 4: Modern Warfare also delivers special effects, including use of depth of field, rim-lighting, character self-shadowing, real time post-processing, texture streaming as well as physics-enabled effects. Infinity Ward deployed a dedicated team from the start to deliver a new level of depth to multiplayer. Building on the hit ""Call of Duty 2"" online experience, Call of Duty 4: Modern Warfare's new multiplayer provides the community an addictive and accessible experience to gamers of all levels. [Activision]"
193,Forza Horizon 4,"Sep 28, 2018","Racing, Simulation, Automobile",Dreamcast,Playground Games,E,,92,8.3,88,1687,Up to 12 Players,"For the first time in the racing and driving genre, experience dynamic seasons in a shared open-world. Explore beautiful scenery, collect over 450 cars, and become a Horizon Superstar in historic Britain."
194,God of War III,"Mar 16, 2010","Action Adventure, Fantasy, Fantasy, Linear",Dreamcast,SCE Santa Monica,M,Blood and Gore Intense Violence Nudity Strong Language Strong Sexual Content,92,8.8,101,3699,1 Player,"Set in the realm of brutal Greek mythology, God of War III is a single-player game which allows players to take on the climatic role of the ex-Spartan warrior, Kratos, as he scales through the intimidating heights of Mt. Olympus and the dark depths of Hell to seek revenge on those who have betrayed him. Armed with double-chained blades, and an array of new weapons and magic for this iteration of the trilogy, Kratos must take on mythology’s darkest creatures while solving intricate puzzles throughout his merciless quest to destroy Olympus. [SCEA]"
195,Divinity: Original Sin II - Definitive Edition,"Aug 31, 2018","Role-Playing, Western-Style",Dreamcast,Larian Studios Games,M,,92,7.6,12,143, Online Multiplayer,"Set a thousand years after the first game, Divinity: Original Sin II presents a darker, more grounded narrative and expands on the tactical combat system of its award-winning predecessor. In Divinity: Original Sin, you were on a quest for the forbidden Source magic. Now, you yourself are a Sourcerer: a dangerously powerful individual whose abilities summon creatures from the encroaching Void. The Divine is dead and the Void is everywhere. Sourcerers are blamed and the Divine Order is leading the charge against the threat: you. Captured and sent to Fort Joy, you will be ""cured"" of your powers -- no matter the cost. But the Order has secrets of its own that may cast doubt on its so-called holy mission. As you escape from Fort Joy, you realize that if the world remains godless, it will be consumed by the Void."
196,NFL 2K3,"Aug 21, 2002","Sports, Traditional, Football, Sim",Dreamcast,Visual Concepts,E,,92,6.5,24,15,1-4 Players,"NFL 2K3 upgrades Sega Sports' football series with realistic player animations, play-calling intelligence, and an on-the-fly audible system. With Franchise mode, you get total team control as player, coach, and general manager. A new ESPN broadcast system lets you review all the highlights from your games. Now you can track the best players, make the smartest trades, and build the most dominant team in the league. NFL 2K3 also brings you closer to the action with updated rosters and authentic stadiums."
197,SSX Tricky,"Nov  5, 2001","Sports, Alternative, Snowboarding",Dreamcast,EA Canada,E,Comic Mischief Mild Language Mild Violence,92,8.9,33,108,1-2 Players,"Second-generation rider physics provide more in-air and on-snow user control. Compete in the World Circuit, go head-to-head in the unique Showoff (trick) versions of nine courses on the World Circuit, or just kick it in Free Ride. New Garibaldi and Alaska courses let you get more vertical and catch more air, while all the original courses have some new surprises. [Electronic Arts]"
198,NHL 2002,"Sep 24, 2001","Sports, Traditional, Ice Hockey, Sim",Dreamcast,EA Sports,E,Comic Mischief Violence,92,8.3,22,26,1-8 Players,"The PlayStation 2 version features include Career Mode, allowing you to compete for the Stanley Cup for 10 consecutive years and build a true hockey dynasty. Also included are Quick Game, Season, Playoffs, Shootout, and Tournament modes.  [EA Sports]"
199,Guitar Hero II,"Apr  3, 2007","Action, Miscellaneous, Rhythm, Music, Music",Dreamcast,Harmonix Music Systems,T,Lyrics,92,8.1,55,246,1-2 Players,"Rock the Rhythm, Lead, and Bass Guitar tracks in the follow-up sequel to ""Guitar Hero."" Form your guitar duo and shred riffs cooperatively or go head to head in all new multiplayer modes. With over 55 tracks to rock out to, you'll go from Guitar Hero to Guitar god in one press of a fret button. Choose from multiple rock characters and jam at concert venues that grow in size as your rock career progresses. You'll start your rock career playing small clubs and bars, but if you play well you'll work your way up to stadiums and arenas. Guitar Hero II takes the guitar rock experience to new volumes by allowing players to play 3 different guitar tracks: Rhythm, Bass, and Lead. Guitar Hero II introduces all new multiplayer modes like: cooperative, pro-face off, and face off, letting 2 Guitar Heroes conduct their own symphonies of destruction. Shred School: Guitar Hero II features an all new practice mode, allowing Guitar Zeroes to become Guitar Heroes with enough practice. With Guitar Hero II for Xbox 360 rock rhythm, lead, or bass guitar tracks with downloadable content and the new X-Plorer controller, designed specifically for the Xbox 360. [RedOctane]"
200,Prince of Persia: The Sands of Time,"Nov  6, 2003","Action Adventure, Fantasy",Dreamcast,Ubisoft,T,Blood Suggestive Themes Violence,92,8.8,44,378,1 Player,"Amidst the sands of ancient Persia, a young Prince unleashes a deadly evil. Embark on a harrowing quest to restore peace and the fabric of Time. Embody a legendary hero with gravity-defying acrobatics, ferocious fighting combos, and the ability to bend time to fulfill his bidding. Wield the power of the Sands of Time - a mythical force allowing the Prince to erase the past, behold the future, and freeze the present. You'll uncover the mysteries of a world never before explored in action-adventure gaming. Ancient Persia, mythical and deadly, holds a staggering array of landscapes and kingdoms to explore and conquer. [Ubi Soft]"
201,Uncharted 3: Drake's Deception,"Nov  1, 2011","Action Adventure, Modern, Modern, Linear",Dreamcast,Naughty Dog,T,Blood Language Violence,92,8.4,97,5052,"1 Player 1-2 Players, 12 Players Online Up to 10 Players","A search for the fabled ""Atlantis of the Sands"" propels fortune hunter Nathan Drake on a trek into the heart of the Arabian Desert. When the terrible secrets of this lost city are unearthed, Drake's quest descends into a desperate bid for survival that strains the limits of his endurance and forces him to confront his deepest fears. "
202,Rock Band,"Nov 20, 2007","Action, Miscellaneous, Rhythm, Music, Music",Dreamcast,Harmonix Music Systems,T,Lyrics Mild Suggestive Themes,92,8.0,72,190,"1-4 Players, 4 Players Online","Play together in your living room or across the world! Rock Band offers deep online functionality, allowing players to rock together whether they’re in Rhode Island or Reykjavik. Major record labels and leading music publishers have signed on to provide unrivaled access to master recordings and legendary rock artists – from punk, metal and alternative to classic and southern rock. Rock Band ships with 45 fearsome tracks from artists like Bon Jovi and The Ramones to Black Sabbath and Stone Temple Pilots. Full support for downloadable content delivers never-ending challenges. New content will be available every week. Download full albums for play with Rock Band including the iconic rock album 'Who's Next' by The Who. Metallica has signed on to offer several tracks as digitally-distributed game levels for Rock Band as well as ""Enter Sandman"" for the Rock Band ship disc. Create your own rock avatar! Mold a unique rocker using Rock Band's character creator. Chose from gender, body shape, face, hair, clothes, tattoos and signature moves. Don't forget to pick your specialized rockin’ instrument. Drumming in the spotlight! Showcase a real drum solo with Rock Band's freestyle drum fill windows featured in each song. Break out your own rhythm and style as anything goes! Vocalists can bring the crowd to their feet during Rock Band’s freestyle vocal fill windows. Ad-lib your own words or shout to the crowd to raise the rock intensity of the performance. Band mates can fail out of a song for poor performance, but the band still plays on. Rescue your failing mate by busting out signature moves and blistering solos to wow the crowd with showmanship. Earn bonus points for your band during Rock Band’s Unison Phrase opportunities if everyone plays perfectly. [Harmonix]"
203,Journey,"Jul 21, 2015","Action, Platformer, 3D",Dreamcast,Tricky Pixels,E,,92,8.3,45,2568,2 Players,"The pioneers that brought you the award-winning PlayStation Network titles flOw & Flower are back with another title that challenges traditional gaming conventions. With Journey, thatgamecompany (TGC) continues its tradition of delivering simple gameplay and accessible controls in a rich interactive environment that invites players to explore and experience emotional chords that are still uncommon in video games.

An exotic adventure with a more serious tone, Journey presents TGCs unique vision of an online adventure experience. Awakening in an unknown world, the player walks, glides, and flies through a vast and awe-inspiring landscape, while discovering the history of an ancient, mysterious civilization along the way.

Journeys innovative approach to online play encourages players to explore this environment with strangers who cross their path from time to time. By traveling together, they can re-shape the experience  creating authentic moments they will remember and discuss with others."
204,Bloodborne,"Mar 24, 2015","Fantasy, Role-Playing, Action Adventure, General, Action RPG",Dreamcast,From Software,M,,92,8.9,100,12009,Up to 5 Players,"Bloodborne is an action RPG in which you hunt for answers in the ancient city of Yharnam, now cursed with a strange endemic illness spreading through the streets like a disease. Peril, death and madness infest this dark world, and you're tasked with uncovering its darkest secrets which will be necessary for you to survive. Armed with a singular arsenal of weaponry, including guns and saw cleavers, you'll require wits, strategy and reflexes to dispatch the agile and intelligent enemies that guard the city's underbelly. You will utility holy chalices to access an array of vast underground ruins, chock full of traps, beasts, and rewards, to explore and conquer on your own or with other people."
205,Eternal Darkness: Sanity's Requiem,"Jun 23, 2002","Action Adventure, Horror",Dreamcast,Silicon Knights,M,,92,8.7,41,248,1 Player,"This horror story spans generations, so you must relive the blood-soaked history while conjuring spells, solving puzzles, and slaying supernatural beasts. Whether you're creeping around as the Roman Centurion, Cambodian villager, or any of the other characters, the psychological thriller will challenge you to use your mind as well as your might. The story is historically based and features many significant real-world events and locations, including the blood-soaked fields of the Somme, the jungle-ridden temples of Angkor Wat, the deserts of Persia, and the haunted vales of Rhode Island."
206,Warcraft III: Reign of Chaos,"Jul  3, 2002","Strategy, Real-Time, Fantasy, General, Fantasy",Dreamcast,Blizzard Entertainment,T,Animated Violence Blood Violence,92,9.2,40,2269,1 Player,"[Metacritic's 2002 PC Game of the Year] It has been nearly fifteen years since the war between the orcs and humans ended. An uneasy peace settled over the land while, for years, the drums of war were silent. Yet the kingdoms of men grew complacent in their victory - and slowly, the defeated orcish clans regrouped under the banner of a new visionary leader. Now a darker shadow has fallen over the world, threatening to extinguish all life - all hope. The drums of war play upon the winds once again - rising urgently towards the inevitable hour when the skies will rain fire - and the world will tremble before the coming of the Burning Legion. The Day of Judgment has come... [Blizzard]"
