,game,release_date,genre,platforms,developer,esrb_rating,ESRBs,metascore,userscore,critic_reviews,user_reviews,num_players,summary
0,The Legend of Zelda: Ocarina of Time,"Nov 23, 1998","Action Adventure, Fantasy",Nintendo 64,Nintendo,E,Violence,99,9.1,22,6982,1 Player,"As a young boy, Link is tricked by Ganondorf, the King of the Gerudo Thieves. The evil human uses Link to gain access to the Sacred Realm, where he places his tainted hands on Triforce and transforms the beautiful Hyrulean landscape into a barren wasteland. Link is determined to fix the problems he helped to create, so with the help of Rauru he travels through time gathering the powers of the Seven Sages."
1,Tony Hawk's Pro Skater 2,"Sep 20, 2000","Sports, Alternative, Skateboarding",PlayStation,Neversoft Entertainment,T,Mild Animated Violence Mild Language,98,7.4,19,786,1-2 Players,"As most major publishers' development efforts shift to any number of next-generation platforms, Tony Hawk 2 will likely stand as one of the last truly fantastic games to be released on the PlayStation."
2,Grand Theft Auto IV,"Apr 29, 2008","Action Adventure, Modern, Modern, Open-World",PlayStation 3,Rockstar North,M,Blood Intense Violence Partial Nudity Strong Language Strong Sexual Content Use of Alcohol Use of Drugs Use of Drugs and Alcohol,98,7.8,64,4529,1 Player,"[Metacritic's 2008 PS3 Game of the Year; Also known as ""GTA IV""]  What does the American Dream mean today? For Niko Belic, fresh off the boat from Europe. It's the hope he can escape his past. For his cousin, Roman, it is the vision that together they can find fortune in Liberty City, gateway to the land of opportunity. As they slip into debt and are dragged into a criminal underworld by a series of shysters, thieves and sociopaths, they discover that the reality is very different from the dream in a city that worships money and status, and is heaven for those who have them an a living nightmare for those who don't. [Rockstar Games]"
3,SoulCalibur,"Sep  8, 1999","Action, Fighting, 3D",Dreamcast,Namco,T,Animated Violence Suggestive Themes,98,8.5,24,373,1-2 Players,"This is a tale of souls and swords, transcending the world and all its history, told for all eternity... The greatest weapons-based fighter returns, this time on Sega Dreamcast. Soul Calibur unleashes incredible graphics, fantastic fighters, and combos so amazing they'll make your head spin!"
4,Grand Theft Auto IV,"Apr 29, 2008","Action Adventure, Modern, Modern, Open-World",Xbox 360,Rockstar North,M,Blood Intense Violence Partial Nudity Strong Language Strong Sexual Content Use of Alcohol Use of Drugs Use of Drugs and Alcohol,98,7.9,86,3594,1 Player,"[Metacritic's 2008 Xbox 360 Game of the Year; Also known as ""GTA IV""]  What does the American Dream mean today? For Niko Belic, fresh off the boat from Europe. It's the hope he can escape his past. For his cousin, Roman, it is the vision that together they can find fortune in Liberty City, gateway to the land of opportunity. As they slip into debt and are dragged into a criminal underworld by a series of shysters, thieves and sociopaths, they discover that the reality is very different from the dream in a city that worships money and status, and is heaven for those who have them an a living nightmare for those who don't. [Rockstar Games]"
5,Super Mario Galaxy,"Nov 12, 2007","Action, Platformer, Platformer, 3D, 3D",Wii,Nintendo,E,Mild Cartoon Violence,97,9.1,73,3553,1-2 Players,"[Metacritic's 2007 Wii Game of the Year] The ultimate Nintendo hero is taking the ultimate step ... out into space. Join Mario as he ushers in a new era of video games, defying gravity across all the planets in the galaxy. When some creature escapes into space with Princess Peach, Mario gives chase, exploring bizarre planets all across the galaxy. Mario, Peach and enemies new and old are here. Players run, jump and battle enemies as they explore all the planets in the galaxy. Since this game makes full use of all the features of the Wii Remote, players have to do all kinds of things to succeed: pressing buttons, swinging the Wii Remote and the Nunchuk, and even pointing at and dragging things with the pointer. Since he's in space, Mario can perform mind-bending jumps unlike anything he's done before. He'll also have a wealth of new moves that are all based around tilting, pointing and shaking the Wii Remote. Shake, tilt and point! Mario takes advantage of all the unique aspects of the Wii Remote and Nunchuk controller, unleashing new moves as players shake the controller and even point at and drag items with the pointer. [Nintendo]"
6,Super Mario Galaxy 2,"May 23, 2010","Action, Platformer, Platformer, 3D, 3D",Wii,Nintendo EAD Tokyo,E,,97,9.1,87,2787,,"Super Mario Galaxy 2, the sequel to the galaxy-hopping original game, includes the gravity-defying, physics-based exploration from the first game, but is loaded with entirely new galaxies and features to challenge players. On some stages, Mario can pair up with his dinosaur buddy Yoshi and use his tongue to grab items and spit them back at enemies. Players can also have fun with new items such as a drill that lets our hero tunnel through solid rock. [Nintendo]"
7,Red Dead Redemption 2,"Oct 26, 2018","Action Adventure, Open-World",Xbox One,Rockstar Games,M,,97,8.1,33,4230,,"Developed by the creators of Grand Theft Auto V and Red Dead Redemption, Red Dead Redemption 2 is an epic tale of life in America’s unforgiving heartland. The game’s vast and atmospheric world also provides the foundation for a brand new online multiplayer experience. America, 1899. The end of the Wild West era has begun. After a robbery goes badly wrong in the western town of Blackwater, Arthur Morgan and the Van der Linde gang are forced to flee. With federal agents and the best bounty hunters in the nation massing on their heels, the gang has to rob, steal and fight their way across the rugged heartland of America in order to survive. As deepening internal fissures threaten to tear the gang apart, Arthur must make a choice between his own ideals and loyalty to the gang that raised him. [Rockstar]"
8,Grand Theft Auto V,"Nov 18, 2014","Action Adventure, Modern, Open-World",Xbox One,Rockstar North,M,,97,7.8,14,1614,,"Grand Theft Auto 5 melds storytelling and gameplay in unique ways as players repeatedly jump in and out of the lives of the game's three protagonists, playing all sides of the game's interwoven story."
9,Grand Theft Auto V,"Sep 17, 2013","Modern, Action Adventure, Modern, Open-World",PlayStation 3,Rockstar North,M,,97,8.3,50,4847,,"Los Santos is a vast, sun-soaked metropolis full of self-help gurus, starlets and once-important, formerly-known-as celebrities. The city was once the envy of the Western world, but is now struggling to stay afloat in an era of economic uncertainty and reality TV. Amidst the chaos, three unique criminals plot their own chances of survival and success:  Franklin, a former street gangster in search of real opportunities and serious cheddar; Michael, a professional ex-con whose retirement is a lot less rosy than he hoped it would be; and Trevor, a violent maniac driven by the chance of a cheap high and the next big score. Quickly running out of options, the crew risks it all in a sequence of daring and dangerous heists that could set them up for life."
10,Disco Elysium: The Final Cut,"Mar 30, 2021","Role-Playing, General, Western-Style",PC,ZA/UM,M,,97,8.2,11,559,,"Disco Elysium - The Final Cut is the definitive edition of the smash-hit RPG. Pursue your political dreams in new quests, meet and question more of the city's locals, and explore a whole extra area. Full voice-acting, controller support, and expanded language options also included. Get even more out of this award-winning open world. You're a detective with a unique skill system at your disposal and a whole city block to carve your path across. Interrogate unforgettable characters, crack murders, or take bribes. Become a hero or an absolute disaster of a human being."
11,Grand Theft Auto V,"Sep 17, 2013","Modern, Action Adventure, Modern, Open-World",Xbox 360,Rockstar North,M,,97,8.3,58,4058,,"Los Santos is a sprawling sun-soaked metropolis full of self-help gurus, starlets and once-important stars. The city was once the envy of the Western world, but is now struggling to stay relevant in an era of economic uncertainty and reality TV. Amidst the chaos, three very different criminals chart their own chances of survival and success:  Franklin, a former street gangster, now looking for real opportunities and fat stacks of cash; Michael, a professional ex-con whose retirement is significantly less rosy than he hoped it would be; and Trevor, a violent maniac driven by the chance of a cheap high and the next big score. Rapidly running out of options, the crew risks everything in a series of bolt and dangerous heists that could set them up for the long haul."
12,Tony Hawk's Pro Skater 2,"Nov  6, 2000","Sports, Alternative, Skateboarding",Dreamcast,Treyarch,T,Mild Animated Violence Mild Language,97,6.2,18,102,,"Hawk's back - with new technology, new pros and new tricks! THPS2, the legend rides on! Skate as legendary Tony Hawk or any one of 12 other pro skaters. Create your own custom skaters. Multiple play modes including 1-Player, Career and Free Skate modes, as well as 2-player modes such as Trick Attack, Graffiti Tag and Horse. Build your own custom skate parks with the real-time 3D park editor."
13,The Legend of Zelda: Breath of the Wild,"Mar  3, 2017","Action Adventure, Open-World",Switch,Nintendo,E10+,,97,8.7,109,18381,1 Player,"Forget everything you know about The Legend of Zelda games. Step into a world of discovery, exploration and adventure in The Legend of Zelda: Breath of the Wild, a boundary-breaking new game in the acclaimed series. Travel across fields, through forests and to mountain peaks as you discover what has become of the ruined kingdom of Hyrule in this open-air adventure. Explore the wilds of Hyrule any way you like - Climb up towers and mountain peaks in search of new destinations, then set your own path to get there and plunge into the wilderness. Along the way, you'll battle towering enemies, hunt wild beasts and gather ingredients for the food and elixirs you'll need to sustain you on your journey. More than 100 Shrines of Trials to discover and explore - Shrines dot the landscape, waiting to be discovered in any order you want. Search for them in various ways, and solve a variety of puzzles inside. Work your way through the traps and devices inside to earn special items and other rewards that will help you on your adventure.
*    Be prepared and properly equipped - With an entire world waiting to be explored, you'll need a variety of outfits and gear to reach every corner. You may need to bundle up with warmer clothes or change into something better suited to the desert heat. Some clothing even has special effects that, for example, can make you faster and stealthier.
*    Battling enemies requires strategy - The world is inhabited with enemies of all shapes and sizes. Each one has its own attack method and weaponry, so you must think quickly and develop the right strategies to defeat them.
*    amiibo compatibility - Tap the Wolf Link amiibo (sold separately) to make Wolf Link appear in game. Wolf Link will attack enemies on his own and help you find items you're searching for."
14,Tony Hawk's Pro Skater 3,"Oct 28, 2001","Sports, Alternative, Skateboarding",PlayStation 2,Neversoft Entertainment,T,Blood Mild Lyrics Suggestive Themes,97,7.5,34,438,1-2 Players,Challenge up to four friends in online competitions over a LAN or the Internet.  Take them on in both Trick Attack and Graffiti modes. [Activision]
15,Perfect Dark,"May 22, 2000","Action, Shooter, First-Person, Sci-Fi",Nintendo 64,Rare Ltd.,M,Animated Blood Animated Violence,97,8.8,30,472,1 Player,"Step into the Dark... As Carrington Institute's most promising new Agent, Joanna Dark must uncover the truth behind the dataDyne Corporation's recent technological breakthroughs - breakthroughs which could have serious consequences for mankind."
16,Red Dead Redemption 2,"Oct 26, 2018","Action Adventure, Open-World",PlayStation 4,Rockstar Games,M,,97,8.6,99,18483,Up to 32 Players,"Developed by the creators of Grand Theft Auto V and Red Dead Redemption, Red Dead Redemption 2 is an epic tale of life in America’s unforgiving heartland. The game’s vast and atmospheric world also provides the foundation for a brand new online multiplayer experience. America, 1899. The end of the Wild West era has begun. After a robbery goes badly wrong in the western town of Blackwater, Arthur Morgan and the Van der Linde gang are forced to flee. With federal agents and the best bounty hunters in the nation massing on their heels, the gang has to rob, steal and fight their way across the rugged heartland of America in order to survive. As deepening internal fissures threaten to tear the gang apart, Arthur must make a choice between his own ideals and loyalty to the gang that raised him. [Rockstar]"
17,Grand Theft Auto V,"Nov 18, 2014","Action Adventure, Modern, Open-World",PlayStation 4,Rockstar North,M,,97,8.3,66,7144,Up to 30 Players,"The sprawling sun-soaked metropolis of Los Santos is chock full of self-help coaches, starlets and C-List celebrities, once on top of the media world, now struggling to stay relevant in time of economic malaise and lowest-common-denominator reality TV. Amidst this madness, three unique criminals plan their own chances of survival and success: Franklin, a street-level hustler in search of opportunities for serious money; Michael, an ex-con whose ""retirement"" is a less rosy than he hoped it would be; and Trevor, a violent dude driven by the chance for a quick high and the next big score. Nearly out of options, the crew risks it all in a series of daring and dangerous heists that could set them up for life - one way or the other."
18,Jet Grind Radio,"Oct 30, 2000","Action, Platformer, 3D",Dreamcast,Smilebit,T,Animated Violence Mild Language,94,8.3,24,105,1 Player,"Join a graffiti crew, stamp your territory and protect it from rival taggers, but watch out for the angry cops!"
19,Metal Gear Solid,"Oct 21, 1998","Action Adventure, Modern",PlayStation,KCEJ,M,Animated Blood and Gore Animated Violence Mature Sexual Themes,94,9.2,20,1812,1 Player,"You are Snake, a government agent on a mission to regain control of a secret nuclear weapons base from terrorist hands. Lightly armed and facing an army of foes, Snake must avoid firefights in order to survive. If Snake can locate them he can utilize advanced hardware, ranging from silenced pistols to ground-to-air missiles. Enemies react to sight and sound - so stay quiet and stay in the shadows. State-of-the-art graphics: textures, transparencies, models and explosions. Taut, gripping story with multiple endings - a truly cinematic experience."
20,Metroid Prime,"Nov 17, 2002","Action, Shooter, First-Person, Sci-Fi",GameCube,Retro Studios,T,Violence,97,8.9,70,1330,1 Player,"Samus returns in a new mission to unravel the mystery behind the ruined walls scattered across Tallon IV. In Metroid Prime, you'll play the role of this bounty hunter and view the world through her visor, which displays information ranging from current energy levels to ammunition. Equipped with a Power Beam and Gravity Suit, you must shoot locked switches, solve puzzles, and eliminate enemies. It's up to you to explore the world and recover more power-ups and weapons, which gradually open more gameplay areas."
21,Grand Theft Auto III,"Oct 22, 2001","Action Adventure, Modern",PlayStation 2,DMA Design,M,Blood Strong Language Violence,97,8.4,56,1043,1 Player,"Players are put at the heart of their very own gangster movie, and let loose in a fully-realised 3 dimensional city with a cast of hundreds, 50 plus vehicles, ranging from sports cars to ice cream trucks and from boats to buses, 3 hours of music, including opera, reggae, house, drum and bass, pop and disco, and a huge array of street ready weapons.  [Rockstar Games]"
22,Super Mario Odyssey,"Oct 27, 2017","Action, Platformer, 3D",Switch,Nintendo,E10+,,97,8.9,113,6641,1 Player,"New Evolution of Mario Sandbox-Style Gameplay. Mario embarks on a new journey through unknown worlds, running and jumping through huge 3D worlds in the first sandbox-style Mario game since Super Mario 64 and Super Mario Sunshine. Set sail between expansive worlds aboard an airship, and perform all-new actions, such as throwing Mario's cap."
23,Halo: Combat Evolved,"Nov 14, 2001","Action, Shooter, First-Person, Sci-Fi",Xbox,Bungie Software,M,Blood and Gore Violence,97,8.7,68,2825,1-4 Players,"Enter the mysterious world of Halo, an alien planet shaped like a ring.  As mankind's super soldier Master Chief, you must uncover the secrets of Halo and fend off the attacking Covenant.  During your missions, you'll battle on foot, in vehicles, inside, and outside with alien and human weaponry.  Your objectives include attacking enemy outposts, raiding underground labs for advanced technology, rescuing fallen comrades, and sniping enemy forces.  Halo also lets you battle three other players via intense split screen combat or fight cooperatively with a friend through the single-player missions.  "
24,NFL 2K1,"Sep  7, 2000","Sports, Traditional, Football, Sim",Dreamcast,Visual Concepts,E,,97,6.1,22,80,1 Player,"In the end, NFL 2K1 is a deeper, more refined version of the original game."
25,Half-Life 2,"Nov 16, 2004","Action, Shooter, Shooter, First-Person, Sci-Fi, Sci-Fi, Arcade",Dreamcast,Valve Software,M,Blood Intense Violence,96,9.2,81,12114,1 Player,"[Metacritic's 2004 PC Game of the Year]  By taking the suspense, challenge and visceral charge of the original, and adding startling new realism and responsiveness, Half-Life 2 opens the door to a world where the player's presence affects everything around him, from the physical environment to the behaviors -- even the emotions -- of both friends and enemies. The player again picks up the crowbar of research scientist Gordon Freeman, who finds himself on an alien-infested Earth being picked to the bone, its resources depleted, its populace dwindling. Freeman is thrust into the unenviable role of rescuing the world from the wrong he unleashed back at Black Mesa. And a lot of people -- people he cares about -- are counting on him. [Vivendi Universal]"
26,Grand Theft Auto V,"Apr 13, 2015","Modern, Action Adventure, Open-World",Dreamcast,Rockstar North,M,,96,7.8,57,8176,Up to 32 Players,"Los Santos: a sprawling sun-soaked metropolis full of self-help gurus, starlets and fading celebrities, once the envy of the Western world, now struggling to stay alive in a time of economic uncertainty and cheap reality TV. Amidst the turmoil, three very unique criminals plot their own chances of survival and success: Franklin, a street hustler looking for tangible opportunities and serious money; Michael, a professional ex-con whose retirement is less rosy than he figured it would be; and Trevor, a violent dude driven by the opportunity for a cheap high and his next big score. With options at a premium, the crew risks it all in a myriad of daring and dangerous heists that could set them up for life."
27,The Legend of Zelda: Breath of the Wild,"Mar  3, 2017","Fantasy, Fantasy, Action Adventure, Open-World",Dreamcast,Nintendo,E10+,,96,8.3,13,2400,1 Player,"Ignore everything you know about The Legend of Zelda games. Step into a world of discovery, exploration and adventure in The Legend of Zelda: Breath of the Wild. Travel across fields, through forests and to mountain peaks as you discover what has become of the ruined kingdom of Hyrule in this stunning open-air adventure. Explore the wilds of Hyrule any way you like - Climb up towers and mountain peaks in search of new destinations, then set your own path to get there and plunge into the wilderness. Along the way, you'll battle towering enemies, hunt wild beasts and gather ingredients for the food and elixirs you'll need to sustain you on your journey. More than 100 Shrines of Trials to discover and explore - Shrines dot the landscape, waiting to be discovered in any order you want. Search for them in various ways, and solve a variety of puzzles inside. Work your way through the traps and devices inside to earn special items and other rewards that will help you on your adventure. Be prepared and properly equipped - With an entire world waiting to be explored, you'll need a variety of outfits and gear to reach every corner. You may need to bundle up with warmer clothes or change into something better suited to the desert heat. Some clothing even has special effects that, for example, can make you faster and stealthier. [Nintendo]"
28,BioShock,"Aug 21, 2007","Action, Shooter, Shooter, First-Person, Sci-Fi, Sci-Fi, Arcade",Dreamcast,"Irrational Games, 2K Marin",M,Blood and Gore Drug Reference Intense Violence Sexual Themes Strong Language,96,9.0,88,2897,1 Player,"[Metacritic's 2007 Xbox 360 Game of the Year] Going beyond ""run and gun corridors,"" ""monster-closet AIs"" and static worlds, BioShock creates a living, unique and unpredictable FPS experience. After your plane crashes into icy uncharted waters, you discover a rusted bathysphere and descend into Rapture, a city hidden beneath the sea. Constructed as an idealistic society for a hand picked group of scientists, artists and industrialists, the idealism is no more. Now the city is littered with corpses, wildly powerful guardians roam the corridors as little girls loot the dead, and genetically mutated citizens ambush you at every turn. Take control of your world by hacking mechanical devices, commandeering security turrets and crafting unique items critical to your very survival. Upgrade your weapons with ionic gels, explosives and toxins to customize them to the enemy and environment. Genetically modify your body through dozens of Plasmid Stations scattered throughout the city, empowering you with fantastic and often grotesque abilities. Explore a living world powered by Ecological A.I., where the inhabitants have interesting and consequential relationships with one another that impact your gameplay experience. Experience truly next generation graphics that vividly illustrate the forlorn art deco city, highlighted by the most detailed and realistic water effects ever developed in a video game. Make meaningful choices and mature decisions, ultimately culminating in the grand question: do you exploit the innocent survivors of Rapture...or save them? [2K Games]"
29,GoldenEye 007,"Aug 25, 1997","Action, Shooter, First-Person, Modern",Dreamcast,Rare Ltd.,T,Animated Blood Animated Violence,96,9.0,21,760,1-4 Players,You are Bond. James Bond. You are assigned covert operations connected with the GoldenEye weapons satellite. M will brief you on your mission and objectives from London. Q Branch will support your efforts with a plentiful supply of weapons and gadgets. Moneypenny offers you light-hearted best wishes and you're off! Your mission begins in the heavily guarded chemical warfare facility at the Byelomorye Dam in the USSR. Look and shoot in any direction as you navigate 12 interactive 3-D environments. Use stealth and force as you see fit in matters of international security. Consider the military personnel expendable. You are licensed to kill!
30,Uncharted 2: Among Thieves,"Oct 13, 2009","Action Adventure, Modern, Modern, Linear",Dreamcast,Naughty Dog,T,Blood Language Suggestive Themes Violence,96,8.8,105,7400,1 Player,"Fortune hunter Nathan Drake returns in Uncharted 2: Among Thieves, a third-person action-adventure/shooter created by award-winning developer Naughty Dog. Down on his luck, Drake is lured back into the treacherous world of thieves and mercenary treasure-seekers he had sought to leave behind. When a mysterious artifact propels Drake on an expedition to find the legendary Himalayan valley of Shambhala, he finds himself embroiled in a dangerous game of cat-and-mouse against a fugitive war criminal who’s after more than just the fabled riches of the lost city. Caught in a web of deception and plunged into an increasingly deadly pursuit that tests the limits of his endurance, Drake will be forced to risk everything - but has his luck finally run out? [SCEA]"
31,Elden Ring,"Feb 25, 2022","Role-Playing, Action RPG",Dreamcast,From Software,M,,96,7.9,78,8016,Up to 4 Players,"A New World Created By Hidetaka Miyazaki And George R. R. Martin. ELDEN RING, developed by FromSoftware, Inc. and BANDAI NAMCO Entertainment Inc., is a fantasy action-RPG adventure set within a world created by Hidetaka Miyazaki creator of the influential DARK SOULS video game series; and George R.R. Martin author of The New York Times best-selling fantasy series, A Song of Ice and Fire. Danger and discovery lurk around every corner in FromSoftware's largest game to-date.  Hidetaka Miyazaki, President and Game Director of FromSoftware Inc. Known for directing critically-acclaimed games in beloved franchises including Armored Core, Dark Souls, and Sekiro: Shadows Die Twice.  George R.R. Martin is the #1 New York Times bestselling author of many novels, including the acclaimed series A Song of Ice and Fire - A Game of Thrones, A Clash of Kings, A Storm of Swords, A Feast For Crows, and A Dance with Dragons. As a writer-producer, he has worked on The Twilight Zone, Beauty and the Beast, and various feature films and pilots that were never made."
