,game,release_date,genre,platforms,developer,esrb_rating,ESRBs,metascore,userscore,critic_reviews,user_reviews,num_players,summary
408,Rayman 2: The Great Escape,"Oct 31, 1999","Action, Platformer, 3D",Dreamcast,Ubisoft Montpellier,E,Mild Animated Violence,90,8.7,12,108,1 Player,"Enter a massive 3-D action adventure of amazing beauty and challenge. The pirate terror has enslaved the world and only Rayman's speed, agility, and magical powers can save all. Race and battle across 45 intricately designed areas - rainforests, jungles, narrow canyon passes, even into the mighty pirate ship itself."
409,Bayonetta,"Jan  5, 2010","Action, Action Adventure, Beat-'Em-Up, Fantasy, Beat-'Em-Up, Linear",Dreamcast,PlatinumGames,M,Blood and Gore Intense Violence Partial Nudity Strong Language Suggestive Themes,90,8.1,86,745,1 Player,"Bayonetta is a stylish and cinematic action game directed by creator Hideki Kamiya. A member of an ancient witch clan and possessing powers beyond the comprehension of mere mortals, Bayonetta faces-off against countless ethereal enemies, many reaching epic proportions, in a game of 100% pure, unadulterated all-out action. Outlandish finishing moves are performed with balletic grace as Bayonetta flows from one fight to another. With over-the-top action taking place in stages that are a veritable theme park of exciting attractions, Bayonetta pushes the limits of the action genre, bringing to life its fast-paced, dynamic climax combat. [Sega]"
410,Diablo III: Ultimate Evil Edition,"Aug 19, 2014","Action RPG, Role-Playing, Action RPG",Dreamcast,Blizzard Entertainment,M,,90,7.8,63,1516,Up to 4 Players,"PlayStation 4 players can now experience the full adventure of Blizzard’s epic action RPG, Diablo III, and the upcoming expansion, Reaper of Souls all from the comfort of their couch in Diablo III: Ultimate Evil Edition! Take on the role of one of six powerful character class Barbarian, Demon Hunter, Monk, Witch Doctor, Wizard, or the all-new Crusader and embark on a dark journey through Acts I-V to save the world of Sanctuary from ancient and sinister forces. With the new DUALSHOCK 4 wireless controller and a custom-designed console interface, players will be outfitted with touch pad functionality and new social features as they engage in pulse-pounding combat with hordes of monsters and acquire items of incredible power."
411,Overwatch,"May 23, 2016","Action, Shooter, First-Person, Tactical",Dreamcast,Blizzard Entertainment,T,,90,6.4,31,2261,Up to 12 Players,"Overwatch is a highly stylized team-based shooter set on earth in the near future. Every match is an intense multiplayer showdown pitting a diverse cast of soldiers, mercenaries, scientists, adventurers, and oddities against each other in an epic, globe-spanning conflict."
412,Far Cry 3,"Dec  4, 2012","Action, Shooter, Shooter, First-Person, Modern, Modern, Arcade",Dreamcast,Ubisoft Montreal,M,Blood and Gore Intense Violence Nudity Strong Language Strong Sexual Content Use of Drugs,90,8.6,32,1322,Up to 4 Players,"With Far Cry 3, players step into the shoes of Jason Brody, a man alone at the edge of the world, stranded on a mysterious tropical island. In this savage paradise where lawlessness and violence are the only sure thing, players dictate how the story unfolds, from the battles they choose to fight to the allies or enemies they make along the way. As Jason Brody, players will slash, sneak, detonate and shoot their way across the island in a world that has lost all sense of right and wrong."
413,ICO,"Sep 24, 2001","Action Adventure, Fantasy",Dreamcast,SCE Japan Studio,T,Violence,90,8.8,59,493,1 Player,"Assume the role of Ico, a courageous young boy born with horns who has been delivered to a mysterious castle to be sacrificed so that, according to legend, the community will be saved.  Attempt to escape the grounds and save a princess through a variety of mazes, brainteasers, and other puzzles."
414,Tom Clancy's Ghost Recon Advanced Warfighter,"Mar  9, 2006","Action, Shooter, Shooter, First-Person, Tactical, Modern, Modern",Dreamcast,Ubisoft Paris,T,Blood Language Violence,90,7.9,78,236,"1-16 Players, 16 Players Online Up to 16 Players","In 2013, the U.S. Army will implement the Integrated Warfighter System (IWS), evolving what we know as the modern soldier. IWS combines advanced weapon systems, satellite communication devices and enhanced survivability into one fully integrated combat system. The IWS program has been developed to meet these new threats head on. Now, it can be tested on the battlefield. Following an insurgence in the heart of Mexico City, the U.S. Army's most elite Special Forces team is deployed to the center of the conflict to regain control of the city. Greatly outnumbered but fully equipped with the IWS, this elite team is the first and last line of defense on the battlefield. They are the ""Quiet"" professionals. They are the Ghosts. Gain access to the future of military technology. Using a fully integrated combat system with cutting-edge weapons and revolutionary communication systems, gamers embody the soldier of the future. Based on actual U.S. Army research, the Ghosts give gamers a realistic view of how war will be fought in the next decade. Use the revolutionary Cross-Com, a communication device powered by satellite technology. Attached to the soldier's monocle, the Cross-Com provides full situational awareness and command of the battlefield. Command the Ghost squad and remote allied forces and drones, and direct artillery and air strikes. See what the squad sees and receive visual and auditory intel from allied forces and unmanned drones. [Ubisoft]"
415,FIFA Soccer 12,"Sep 27, 2011","Sports, Traditional, Team, Soccer, Sim, Sim",Dreamcast,Electronic Arts,E,,90,7.2,44,367,1 Player,FIFA Soccer 12 brings a new physics engine into the soccer gameplay.
416,World of Goo,"Oct 12, 2008","Miscellaneous, Puzzle, Action, Puzzle, General, Puzzle, General",Dreamcast,2D Boy,E,Comic Mischief,90,8.4,26,750,1-2 Players,"World of Goo is a physics based puzzle / construction game. The millions of Goo Balls that live in the beautiful World of Goo don't know that they are in a game, or that they are extremely delicious. [2D Boy]"
417,Mario & Luigi: Superstar Saga,"Nov 17, 2003","Role-Playing, Console-style RPG",Dreamcast,Alphadream Corporation,E,,90,8.9,42,253,1-4 Players,"An evil witch has replaced Princess Peach's fair speech with explosives!  Mario and Luigi must once again come to her rescue, but this time they employ the help of Bowser, their sworn enemy.  Mario and Luigi must learn new moves and combine powers to fight off enemies and move closer to the witch's castle.  Guide this unlikely bunch through an abundance of minigames such as Border Jump and Mystery Carts.  Combine the powers of Mario and Luigi to pull off special tag-team moves. Immerse yourself in this bright, cartoonish, and humorous world, complete with hit music featured in previous Mario games."
418,Shovel Knight,"Apr 21, 2015","Action, Platformer, 2D",Dreamcast,Yacht Club Games,E,,90,7.7,18,442,1 Player,"Shovel Knight is a sweeping classic action adventure game with awesome gameplay, memorable characters, and an 8-bit retro aesthetic. It's a hot mashup of new and old! You play as the eponymous Shovel Knight, a small knight with a huge quest. Shovel Knight has come to this land with two goals: to defeat the evil Enchantress and quest for his lost beloved. He wields a Shovel Blade: a multipurpose weapon whose techniques have now been lost to the ages. Always honest and helpful, Shovel Knight is a shining example of the code of Shovelry: Slash Mercilessly and Dig Tirelessly!

But, between Shovel Knight and his beloved stands a cadre of villainous knights. These terrible foes, known as The Order of No Quarter, have been dispatched to prevent Shovel Knight from reaching the Enchantress, and will pursue their mission at any cost. If you love games with perfect platforming, beautiful art, infectious music, crazy bosses, humor and levity, and real heart... Shovel Knight is for you!"
419,Tony Hawk's Underground,"Oct 27, 2003","Sports, Alternative, Skateboarding",Dreamcast,Neversoft Entertainment,T,Blood Mild Violence Strong Language Suggestive Themes,90,8.7,38,165,1-8 Players,"Get ready for a totally new breed of the Tony Hawk experience. Play as yourself, not a pro skater, and make your way through a plot-twisting, true-to-life story that takes you from unknown local skate punk to fame and fortune as a superstar skater. For the first time ever, you'll be able to get off your board and explore 9 expansive levels on foot or by vehicle. Enjoy unprecedented customization by designing and naming your own original tricks through the all-new Create-a-Trick. Or create bigger parks and include your own goals in the expanded Skate Park Editor. After you're done, share your tricks and parks online with your friends. You can even download your own face into the game! And, with all-new online play - new games, stats, and online rankings - you'll have infinite expansion through downloadable content. You're the star...you own the Underground! [Activision]"
420,Marvel vs. Capcom 2,"Jun 29, 2000","Action, Fighting, 2D",Dreamcast,Capcom,T,Blood Suggestive Themes Violence,90,8.8,22,94,1 Player,"The world's most insane tag-team fantasy fighter is bigger than ever!  An unprecedented 56 characters include the debut of Jill from Resident Evil, Servbots from Mega Man and Cable from Marvel Comics fame.  Experience arcade perfect fighting with 3 on 3 tag-team battles, unbelievable control and hyper-fast animation.  Pick a fight with legendary Capcom characters and Super Heroes from the Marvel Universe and prepare to be amazed."
421,Ape Escape,"May 31, 1999","Action, Platformer, 3D",Dreamcast,SCEI,E,Mild Animated Violence,90,8.5,19,95,1 Player,"A boisterous band of baboons carry out a daring zoo escape. It's ape anarchy and it's up to you to stop the chimps before they make chumps out of the human race! Use both analog sticks to operate great gadgets including a Tank, a Remote Control Car, a Stun Club, and a Time Net in your quest to hunt down over 200 apes!"
422,Syphon Filter,"Jan 31, 1999","Action, Shooter, Third-Person, Modern",Dreamcast,Eidetic,T,Animated Blood Animated Violence,90,8.7,19,181,1 Player,"While it may not be an original concept, the game is truly greater than the sum of its many parts."
423,Mario & Luigi: Bowser's Inside Story,"Sep 14, 2009","Role-Playing, Action RPG, Console-style RPG, Console-style RPG, Japanese-Style",Dreamcast,Alphadream Corporation,E,Comic Mischief Mild Cartoon Violence,90,8.8,58,409,1 Player,"In his evil plot to take over the Mushroom Kingdom, Fawful tricks Bowser into eating a magic mushroom. The mushroom causes Bowser to begin inhaling everything around him, including Mario, Luigi and Princess Peach! Do the Mario Bros. have the guts to rescue Peach and escape? Players are in control of two separate storylines. One features Bowser and his efforts to stop an arch-villain from taking over his castle. Meanwhile, inside Bowser, the microbe-sized Mario & Luigi must muscle their way through challenges and keep their nerve if they want to find a way out. They take action to control Bowser from the inside - but without his knowledge. Players can switch between storylines at will. What happens inside Bowser affects what he’s doing on the outside. Sometimes Mario & Luigi must solve puzzles and challenges behind the scenes to help Bowser overcome various obstacles and advance the plot. Players must make well-timed button presses to enhance their performance during battles and challenges. In some battles, Bowser grows so large that players must turn their Nintendo DS or Nintendo DSi system sideways, blow into the microphone or tap on the touch screen with the stylus to keep up with the action. The game features the same hilarious dialogue that has been the hallmark of the Mario & Luigi series. [Nintendo]"
424,Trials Evolution,"Apr 18, 2012","Driving, Racing, Simulation, Motorcycle, Automobile, Street, Street",Dreamcast,"Ubisoft, RedLynx",E10+,,90,8.0,77,283,1 Player,"The follow-up to Trials HD brings the bike-racing action back to the Xbox 360. Ride in real-time multiplayer with two to four players, either locally or through XBLA. Take part in single player career with 50 tracks, challenging unlocks, and tricky achievements. A massive, track editor lets you build the track of your choosing and share it with the world. Or simply download highly-rated tracks from around the globe using Track Central."
425,Grand Theft Auto IV: The Lost and Damned,"Feb 17, 2009","Action Adventure, Modern, Modern, Open-World",Dreamcast,Rockstar North,M,Blood Intense Violence Nudity Strong Language Strong Sexual Content Use of Alcohol Use of Drugs Use of Drugs and Alcohol,90,8.0,79,371,1 Player,"[Xbox Live Arcade]  Johnny is a veteran member of The Lost, a notorious biker gang. Johnny has been creating business opportunities for The Lost in Liberty City, but his first loyalty must be to the patch he wears on his back and to Billy Grey, the club's President. However, when Billy returns from rehab hell-bent on bloodshed and debauchery, Johnny finds himself in the middle of a vicious turf war with rival gangs for control of a city torn apart by violence and corruption. Can the brotherhood survive? Developed by series creator Rockstar North and set in Liberty City, Grand Theft Auto IV: The Lost and Damned features a new main character, Johnny Klebitz, and plot that intersects with the storyline of Grand Theft Auto IV; new missions that offer an entirely fresh way to explore Liberty City with new multiplayer modes, weapons and vehicles; and a diverse soundtrack with additional music - all with the incredible production values that are the trademarks of Grand Theft Auto. All-new missions and a new storyline that interweaves with the original story arc of Grand Theft Auto IV. Play as Johnny, a member of The Lost Motorcycle Club. Experience Liberty City now with the perspective and lifestyle of a member of a biker gang. Added range of weapons - including the all-new grenade launcher and sawed-off shotgun. New weapons will be available for use in single-player and in all new multiplayer modes. New vehicles - featuring a collection of bikes that include Johnny's own customized heavy-duty chopper. New and improved bike handling and physics. Set of new action-packed multiplayer modes - details coming soon. All-new in-game TV, internet and radio content featuring new radio shows and original music. Plus new side-missions and Xbox 360 Achievement. [Rockstar Games]"
426,FIFA Soccer 12,"Sep 27, 2011","Sports, Traditional, Team, Soccer, Sim, Sim",Dreamcast,Electronic Arts,E,,90,6.8,69,349,1 Player,FIFA Soccer 12 brings a new physics engine into the soccer gameplay.
427,Monster Hunter: World - Iceborne,"Sep  6, 2019","Role-Playing, Action RPG",Dreamcast,Capcom,T,,90,8.1,9,76,1 Player,"Monster Hunter World: Iceborne is the highly anticipated massive expansion to Monster Hunter: World, the best-selling Capcom title of all time with more than 12 million units shipped worldwide adding to the series total of more than 53 million units to date. This gargantuan follow-up rivals the gameplay volume from the original release and features a new icy setting, storyline, monsters, gameplay options, and more.

The game's all-new story picks up after Monster Hunter: World and whisks hunters away to the newly discovered chilly locale that, once fully explored, becomes the largest region in World so far. The new locale is home to several new and returning monsters ready to challenge hunters throughout their expeditions and raises the stakes with the added higher difficulty Master Rank. Iceborne continues the skill-based progression and robust crafting system found in World and expands that with several new gameplay features that broaden the player's combat repertoire. All this leads to the ultimate hunter test against the mysterious new flagship monster, Velkhana."
428,Factorio,"Aug 14, 2020","Strategy, Management, Business / Tycoon",Dreamcast,Wube Software LTD.,,,90,9.1,8,534, Online Multiplayer,"Factorio is a game about building and creating automated factories to produce items of increasing complexity, within an infinite 2D world. Use your imagination to design your factory, combine simple elements into ingenious structures, and finally protect it from the creatures who don't really like you. "
429,Spelunky,"Aug  8, 2013","Action, Platformer, Platformer, 2D, 2D",Dreamcast,"Derek Yu, Mossmouth",,,90,7.4,9,578,1 Player,Spelunky is a unique platformer with randomized levels that offer a new and challenging experience each time you play.
430,FIFA Soccer 10,"Oct 20, 2009","Sports, Traditional, Team, Soccer, Sim, Sim",Dreamcast,EA Sports,E,,90,7.4,63,144,Up to 20 Players,"On the pitch, critical gameplay fundamentals have been enhanced to ensure that FIFA Soccer 10 mirrors real-world soccer, providing more sophisticated ball control, and physical interaction between players. In addition, players now move, behave and position themselves more realistically. On attack, players analyze space more effectively, curve their runs in an attempt to stay onside, create passing lanes naturally, and drive for more variety in attacking options. On defense, new concepts like position priority enable defenders to multitask so dangerous spaces left open by teammates out of position are covered. Plus, slide tackle targeting, press marking, and better-urgency clearance logic provide new options that make defending a tactical skill in FIFA Soccer 10. In goal, a myriad of improvements and refinements to goalkeeper intelligence result in a more responsive and powerful rushing system and ultra-realistic saves. Better balance on lofted through balls, improved goalkeeper intelligence, more realistic shooting mechanics with less shots hitting the goal posts, a practice arena to perfect skills, and a more immersive soccer experience through continuous play and quick free kicks are just a few of the issues raised by fans and addressed in FIFA Soccer 10. Three new innovations revealed today at E3 have been developed to change the player control experience in FIFA Soccer 10. The first-ever true 360 degree dribbling system gives players finer control of the ball, enabling them to find spaces between defenders that previously were not possible. Using an all-new animation technology, skilled dribblers now have the ability to face the defender and use highly responsive lateral dribbling to skip past him. An innovative concept called Freedom in Physical Play enables players to perform wider dribble touches and new collision sharing creates a varied, less predictable, and extended fight for possession between the dribbler and a defender.
FIFA Soccer 10 also features a deeper iteration of the ever-popular Manager Mode with more than 50 major improvements, including new match realism, realistic player transfers based on multiple decision points, and true-to-life player growth curves. [Electronic Arts]"
431,Ratchet & Clank: Going Commando,"Nov 11, 2003","Action, Platformer, 3D",Dreamcast,Insomniac Games,T,Mild Violence,90,9.0,46,395,1 Player,"From the creators of the critically acclaimed smash hit Ratchet & Clank, Insomniac Games, comes the next installment of the most exciting sci-fi action adventure ever. Ratchet & Clank: Going Commando features an enhanced health damage system and weapons upgrade system, beautiful diverse environments, a compelling storyline and a unique arsenal of the coolest new weapons and hi-tech gadgets ever imagined. The more $#@& you blow up, the stronger Ratchet gets and the bigger and badder the weapons you?ll have! Show off in gladiator arenas. Pick off enemies in space combat. Leave competitors to eatin? your dust in hoverbike races. And, run around spherical worlds. [SCEA]"
432,NBA Street Vol. 2,"Apr 28, 2003","Sports, Traditional, Basketball, Arcade",Dreamcast,Electronic Arts,E,,90,8.7,31,85,1-4 Players,"25 NBA legends scrap, battle and brawl for ultimate bragging rights. Play as Dr. J, Bird, Wilt, Moses, and more! Seven authentic urban courts including Soul in the Hole in NYC, Mosswood in Oakland, and more. All-new electrifying moves, passes and alley-oops. Play against the CPU or with up to four ballers. Customize the rules and players to your liking. [Electronic Arts]"
433,Tennis 2K2,"Oct 24, 2001","Sports, Traditional, Tennis",Dreamcast,Hitmaker,E,,90,8.0,13,23,1 Player,"The top seed is back. Take to the courts of Virtua Tennis 2 as you compete to become the world No1. Serve, smash and lob your way through 16 internationally top-ranked male and female players as you go head to head in singles matches or compete with up to 4 players in doubles and mixed doubles matches. With revamped Tournament, Exhibition and World Tour modes its game set and match Virtua Tennis 2."
434,Black & White,"Mar 26, 2001","Strategy, Real-Time, Fantasy, General, Fantasy",Dreamcast,Lionhead Studios,T,Comic Mischief Violence,90,7.7,34,385,1 Player,"Peter Molyneux's highly anticipated ""god game,"" a blend of the genres including strategy, sim, RPG, and puzzle, features the player as a new god in the lands of Eden who must reign with the help of uniquely evolving animals in either a benign or evil fashion."
435,Fallout 3,"Oct 28, 2008","Role-Playing, First-Person, First-Person, Western-Style",Dreamcast,Bethesda Game Studios,M,Blood and Gore Intense Violence Sexual Themes Strong Language Use of Drugs,90,7.9,57,1115,1 Player,"Vault-Tec engineers have worked around the clock on an interactive reproduction of Wasteland life for you to enjoy from the comfort of your own vault. Included is an expansive world, unique combat, shockingly realistic visuals, tons of player choice, and an incredible cast of dynamic characters. Every minute is a fight for survival against the terrors of the outside world – radiation, Super Mutants, and hostile mutated creatures. From Vault-Tec, America's First Choice in Post Nuclear Simulation. Vault 101 - Jewel of the Wastes. For 200 years, Vault 101 has faithfully served the surviving residents of Washington DC and its environs, now known as the Capital Wasteland. Though the global atomic war of 2077 left the US all but destroyed, the residents of Vault 101 enjoy a life free from the constant stress of the outside world. Giant Insects, Raiders, Slavers, and yes, even Super Mutants are all no match for superior Vault-Tec engineering. Yet one fateful morning, you awake to find that your father has defied the Overseer and left the comfort and security afforded by Vault 101 for reasons unknown. Leaving the only home you've ever known, you emerge from the Vault into the harsh Wasteland sun to search for your father, and the truth. [Bethesda Softworks]"
436,The Legend of Zelda: The Wind Waker HD,"Sep 20, 2013","Action Adventure, Fantasy, Fantasy, Open-World",Dreamcast,"Nintendo, HexaDrive",E10+,,90,9.0,70,1352,1 Player,"As the purported definitive version of the game, The Legend of Zelda: The Wind Waker HD is remastered and presented in 1080p graphics. Gamers can experience high-definition cell-shaded presentation on their TVs or entirely on the Wii U GamePad controller. The streamlined interface lets gamers easily manage your inventory—simply slide an item onto any button. Instantly view maps and zoom in on the GamePad controller's touch screen. Enjoy a breezy cruise with the original sail, or switch to the brand-new Swift Sail that lets you gather the wind and speed across the waves. With the new Tingle Bottle feature, you can connect with others over Miiverse. Comments or screenshots others have posted on Miiverse may wash up on the shore or appear in other locations, tucked into bottles. Whenever you want, move around the world in first-person mode, using the GamePad gyroscope to look around you and aim your bow, hookshot, Picto Box, or telescope. You can store more pictographs with your improved Picto Box—handy for creating figurines—and share them with other players on Miiverse. Your pictures, game tips, and messages may also appear in another player's game. Take the adventure to new levels with Hero Mode, available from the moment you start the game. In this mode, you only regain health when you earn a new heart piece or container, use a red potion, or visit a fairy fountain. Also, your enemies do double the damage. [Nintendo]"
437,Ori and the Blind Forest: Definitive Edition,"Sep 27, 2019","Action, Platformer, 2D, , Metroidvania",Dreamcast,Moon Studios,E,,90,8.6,20,385,1 Player,"Ori and the Blind Forest: Definitive Edition delivers a multitude of new areas, difficulty options, and gameplay upgrades that should appeal to both new and seasoned Ori players."
438,ESPN NFL 2K5,"Jul 20, 2004","Sports, Traditional, Football, Sim",Dreamcast,Visual Concepts,E,,90,8.6,37,108,1-2 Players,"ESPN NFL 2K5 is uniting fans with a coupling of the most responsive and intense gameplay and the richest multi-player gaming experience possible. Maximum Tackling brings unique on-field control allowing gamers to go for the wrap-up tackle or deliver the big highlight hit. The addition of the V.I.P. System? allows gamers to play friends, even if they're not there! Players are invited to show off their coaching skills in Franchise mode and utilize Weekly Prep to fully plan the training schedule, intensity, and regimen each week. Full online leagues and tournament play with living rosters rounds out the most complete online experience. [Sega]"
